{"time": "2026-10-24T10:00:00Z", "paused": false, "loops": [{"project": "acme/widgets", "workflow": "issues", "state": "running", "running": 1, "retrying": 0, "files": [{"path": "WORKFLOW.issues.md", "sha256": "2d711642b726b04401627ca9fbac32f5c8530fb1903cc4db02258717921a4881"}], "budget": {"period": "day", "max_tokens": 2000000, "used_tokens": 150}}, {"project": "acme/widgets", "workflow": "pr", "state": "stopped", "detail": "held", "reason": "outside working hours", "running": 0, "retrying": 0, "files": []}], "capacity": {"max_sessions": 4, "running_sessions": 1}, "hours": {"open": true, "next_change": "2026-10-24T18:00:00Z"}, "accounts": [{"name": "claude-main", "runtime": "claude-code", "available": true}, {"name": "pi-alt", "runtime": "pi", "available": false, "exhausted_until": "2026-10-24T15:00:00Z"}], "last_error": "validate WORKFLOW.pr.md: tracker.kind missing"}
